{
  "$schema": "https://json-schema.org/draft/2020-12/schema",
  "$id": "https://github.com/lich13/nexushub/contracts/nexushub-contract.schema.json",
  "title": "NexusHub Contract Registry",
  "type": "object",
  "additionalProperties": false,
  "required": [
    "schemaVersion",
    "hostSurfaces",
    "capabilities",
    "capabilitiesByHostSurface",
    "visual",
    "actions",
    "retiredActions",
    "dtoCatalog"
  ],
  "properties": {
    "retiredActions": { "$ref": "#/$defs/stringList" },
    "schemaVersion": {
      "type": "integer",
      "const": 1
    },
    "hostSurfaces": {
      "type": "array",
      "minItems": 1,
      "uniqueItems": true,
      "items": { "$ref": "#/$defs/nonEmptyString" }
    },
    "capabilities": {
      "type": "array",
      "minItems": 1,
      "uniqueItems": true,
      "items": { "$ref": "#/$defs/nonEmptyString" }
    },
    "capabilitiesByHostSurface": {
      "type": "object",
      "additionalProperties": {
        "type": "array",
        "items": { "$ref": "#/$defs/nonEmptyString" },
        "uniqueItems": true
      }
    },
    "visual": {
      "type": "object",
      "additionalProperties": false,
      "required": [
        "theme",
        "layout",
        "taskFilters",
        "interaction",
        "navigation",
        "corePanelTitles",
        "actionLabels",
        "disabledStates",
        "remoteApiOnly",
        "desktopTauriOnly",
        "forbidden"
      ],
      "properties": {
        "theme": { "$ref": "#/$defs/nonEmptyString" },
        "layout": { "$ref": "#/$defs/nonEmptyString" },
        "taskFilters": { "$ref": "#/$defs/stringList" },
        "interaction": { "$ref": "#/$defs/nonEmptyString" },
        "navigation": { "$ref": "#/$defs/stringList" },
        "corePanelTitles": { "$ref": "#/$defs/stringList" },
        "actionLabels": {
          "type": "object",
          "additionalProperties": { "$ref": "#/$defs/nonEmptyString" }
        },
        "disabledStates": {
          "type": "object",
          "additionalProperties": { "$ref": "#/$defs/nonEmptyString" }
        },
        "remoteApiOnly": { "$ref": "#/$defs/stringList" },
        "desktopTauriOnly": { "$ref": "#/$defs/stringList" },
        "forbidden": {
          "type": "object",
          "additionalProperties": false,
          "required": ["desktopEmbeddedTauri"],
          "properties": {
            "desktopEmbeddedTauri": { "$ref": "#/$defs/stringList" }
          }
        }
      }
    },
    "actions": {
      "type": "array",
      "minItems": 1,
      "items": { "$ref": "#/$defs/action" }
    },
    "dtoCatalog": {
      "type": "object",
      "minProperties": 1,
      "additionalProperties": { "$ref": "#/$defs/dtoCatalogEntry" }
    }
  },
  "$defs": {
    "nonEmptyString": {
      "type": "string",
      "minLength": 1
    },
    "stringList": {
      "type": "array",
      "items": { "$ref": "#/$defs/nonEmptyString" }
    },
    "action": {
      "type": "object",
      "additionalProperties": false,
      "required": ["id", "kind", "scope", "coreUseCase"],
      "properties": {
        "id": { "$ref": "#/$defs/nonEmptyString" },
        "kind": {
          "type": "string",
          "enum": ["rpc", "transport"]
        },
        "scope": {
          "type": "string",
          "enum": ["shared", "host_only", "transport"]
        },
        "coreUseCase": { "$ref": "#/$defs/nonEmptyString" },
        "linuxRpc": { "$ref": "#/$defs/nonEmptyString" },
        "tauriCommand": { "$ref": "#/$defs/nonEmptyString" },
        "webuiWrapper": { "$ref": "#/$defs/nonEmptyString" },
        "dtoOwner": { "$ref": "#/$defs/nonEmptyString" },
        "requestDto": { "$ref": "#/$defs/nonEmptyString" },
        "responseDto": { "$ref": "#/$defs/nonEmptyString" },
        "hostOnlyReason": { "$ref": "#/$defs/nonEmptyString" }
      }
    },
    "dtoCatalogEntry": {
      "type": "object",
      "additionalProperties": false,
      "required": ["core", "webui"],
      "properties": {
        "core": { "$ref": "#/$defs/nonEmptyString" },
        "webui": { "$ref": "#/$defs/nonEmptyString" }
      }
    }
  }
}
