{
  "schemaVersion": 1,
  "hostSurfaces": [
    "linux_server_api",
    "desktop_embedded_tauri"
  ],
  "capabilities": [
    "threads",
    "thread_subagents",
    "codex_desktop",
    "jobs",
    "probe",
    "settings",
    "job_history",
    "app_updater",
    "thread_cleanup",
    "thread_archive_actions",
    "systemd",
    "linux_update_job",
    "prune_backups"
  ],
  "capabilitiesByHostSurface": {
    "linux_server_api": [
      "threads",
      "thread_subagents",
      "jobs",
      "probe",
      "settings",
      "job_history",
      "app_updater",
      "thread_cleanup",
      "thread_archive_actions",
      "systemd",
      "linux_update_job",
      "prune_backups"
    ],
    "desktop_embedded_tauri": [
      "threads",
      "thread_subagents",
      "codex_desktop",
      "jobs",
      "probe",
      "settings",
      "job_history",
      "app_updater",
      "thread_cleanup",
      "thread_archive_actions"
    ]
  },
  "visual": {
    "theme": "system prefers-color-scheme; root-only semantic tokens; text >=4.5:1 and essential controls/focus >=3:1",
    "layout": "152px navigation; 48px collapsed rail; 276px list; 780px reading column; one 767px mobile breakpoint",
    "taskFilters": [
      "全部",
      "运行中",
      "待回复",
      "异常",
      "归档"
    ],
    "interaction": "read-only history; verified local Codex desktop collaboration; explicit archive restoration; keyboard menus and focus-return dialogs; visible-only polling with started-job tracking",
    "navigation": [
      "Codex",
      "Claude Code",
      "Grok Build",
      "Probe",
      "设置"
    ],
    "corePanelTitles": [
      "更新与维护",
      "执行记录",
      "归档任务清理",
      "隐藏任务清理"
    ],
    "actionLabels": {
      "dryRun": "Dry-run",
      "archiveCleanup": "清理归档",
      "archiveConfirm": "确认清理归档",
      "hiddenDryRun": "扫描隐藏线程",
      "hiddenCleanup": "清理隐藏线程",
      "hiddenConfirm": "确认清理隐藏",
      "copyThreadId": "复制线程 ID"
    },
    "disabledStates": {
      "renameArchivedThread": "取消归档后可改名",
      "updateInstallWithoutAvailableVersion": "更新按钮仅在已确认有新版本时显示",
      "cleanupArmBeforeDryRun": "cleanup arm disabled until dry-run returns candidates",
      "cleanupConfirmBeforeArmed": "cleanup execute disabled until confirmation is armed",
      "cleanupDuringMutation": "cleanup controls disabled while dry-run or execute is pending"
    },
    "desktopTauriOnly": [
      "远程连接",
      "本机",
      "远程机器"
    ],
    "forbidden": {
      "desktopEmbeddedTauri": [
        "登录",
        "Turnstile",
        "修改密码"
      ]
    },
    "remoteApiOnly": [
      "服务更新",
      "清理更新备份"
    ]
  },
  "actions": [
    {
      "id": "system.capabilities",
      "kind": "rpc",
      "scope": "shared",
      "coreUseCase": "system.capabilities",
      "linuxRpc": "system.capabilities",
      "tauriCommand": "commands::system::getSystemCapabilities",
      "webuiWrapper": "getSystemCapabilities",
      "dtoOwner": "system",
      "requestDto": "NoRequest",
      "responseDto": "SystemCapabilitiesResponse"
    },
    {
      "id": "system.version",
      "kind": "rpc",
      "scope": "shared",
      "coreUseCase": "system.version",
      "linuxRpc": "system.version",
      "tauriCommand": "commands::system::getSystemVersion",
      "webuiWrapper": "getSystemVersion",
      "dtoOwner": "system",
      "requestDto": "NoRequest",
      "responseDto": "SystemVersionResponse"
    },
    {
      "id": "system.platform",
      "kind": "rpc",
      "scope": "shared",
      "coreUseCase": "system.platform",
      "linuxRpc": "system.platform",
      "tauriCommand": "commands::system::getPlatformOverview",
      "webuiWrapper": "getPlatformOverview",
      "dtoOwner": "system",
      "requestDto": "NoRequest",
      "responseDto": "SystemPlatformResponse"
    },
    {
      "id": "system.providers",
      "kind": "rpc",
      "scope": "shared",
      "coreUseCase": "system.providers",
      "linuxRpc": "system.providers",
      "tauriCommand": "commands::system::listProviders",
      "webuiWrapper": "listProviders",
      "dtoOwner": "system",
      "requestDto": "NoRequest",
      "responseDto": "SystemProvidersResponse"
    },
    {
      "id": "threads.list",
      "kind": "rpc",
      "scope": "shared",
      "coreUseCase": "threads.list",
      "linuxRpc": "threads.list",
      "tauriCommand": "commands::threads::listThreads",
      "webuiWrapper": "listThreads",
      "dtoOwner": "threads",
      "requestDto": "NoRequest",
      "responseDto": "ThreadsListResponse"
    },
    {
      "id": "threads.detail",
      "kind": "rpc",
      "scope": "shared",
      "coreUseCase": "threads.detail",
      "linuxRpc": "threads.detail",
      "tauriCommand": "commands::threads::getThread",
      "webuiWrapper": "getThread",
      "dtoOwner": "threads",
      "requestDto": "NoRequest",
      "responseDto": "ThreadsDetailResponse"
    },
    {
      "id": "threads.subagentDetail",
      "kind": "rpc",
      "scope": "shared",
      "coreUseCase": "threads.subagent_detail",
      "linuxRpc": "threads.subagentDetail",
      "tauriCommand": "commands::threads::getSubagentDetail",
      "webuiWrapper": "getSubagentDetail",
      "dtoOwner": "threads",
      "requestDto": "SubagentDetailRequest",
      "responseDto": "SubagentDetailResponse"
    },
    {
      "id": "threads.blocks",
      "kind": "rpc",
      "scope": "shared",
      "coreUseCase": "threads.blocks",
      "linuxRpc": "threads.blocks",
      "tauriCommand": "commands::threads::getThreadBlocks",
      "webuiWrapper": "getThreadBlocks",
      "dtoOwner": "threads",
      "requestDto": "NoRequest",
      "responseDto": "ThreadsBlocksResponse"
    },
    {
      "id": "threads.archive",
      "kind": "rpc",
      "scope": "shared",
      "coreUseCase": "threads.archive",
      "linuxRpc": "threads.archive",
      "tauriCommand": "commands::threads::archiveThread",
      "webuiWrapper": "archiveThread",
      "dtoOwner": "threads",
      "requestDto": "NoRequest",
      "responseDto": "ThreadsArchiveResponse"
    },
    {
      "id": "threads.restore",
      "kind": "rpc",
      "scope": "shared",
      "coreUseCase": "threads.restore",
      "linuxRpc": "threads.restore",
      "tauriCommand": "commands::threads::restoreThread",
      "webuiWrapper": "restoreThread",
      "dtoOwner": "threads",
      "requestDto": "NoRequest",
      "responseDto": "ThreadsRestoreResponse"
    },
    {
      "id": "threads.rename",
      "kind": "rpc",
      "scope": "shared",
      "coreUseCase": "threads.rename",
      "linuxRpc": "threads.rename",
      "tauriCommand": "commands::threads::renameThread",
      "webuiWrapper": "renameThread",
      "dtoOwner": "threads",
      "requestDto": "NoRequest",
      "responseDto": "ThreadsRenameResponse"
    },
    {
      "id": "jobs.list",
      "kind": "rpc",
      "scope": "shared",
      "coreUseCase": "jobs.list",
      "linuxRpc": "jobs.list",
      "tauriCommand": "commands::jobs::listJobs",
      "webuiWrapper": "listJobs",
      "dtoOwner": "jobs",
      "requestDto": "NoRequest",
      "responseDto": "JobsListResponse"
    },
    {
      "id": "jobs.detail",
      "kind": "rpc",
      "scope": "shared",
      "coreUseCase": "jobs.detail",
      "linuxRpc": "jobs.detail",
      "tauriCommand": "commands::jobs::getJob",
      "webuiWrapper": "getJob",
      "dtoOwner": "jobs",
      "requestDto": "NoRequest",
      "responseDto": "JobsDetailResponse"
    },
    {
      "id": "probe.status",
      "kind": "rpc",
      "scope": "shared",
      "coreUseCase": "probe.status",
      "linuxRpc": "probe.status",
      "tauriCommand": "commands::probe::getProbeStatus",
      "webuiWrapper": "getProbeStatus",
      "dtoOwner": "probe",
      "requestDto": "NoRequest",
      "responseDto": "ProbeStatusResponse"
    },
    {
      "id": "probe.settings.get",
      "kind": "rpc",
      "scope": "shared",
      "coreUseCase": "probe.settings.get",
      "linuxRpc": "probe.settings.get",
      "tauriCommand": "commands::settings::getProbeSettings",
      "webuiWrapper": "getProbeSettings",
      "dtoOwner": "probe",
      "requestDto": "NoRequest",
      "responseDto": "ProbeSettingsGetResponse"
    },
    {
      "id": "probe.settings.save",
      "kind": "rpc",
      "scope": "shared",
      "coreUseCase": "probe.settings.save",
      "linuxRpc": "probe.settings.save",
      "tauriCommand": "commands::settings::saveProbeSettings",
      "webuiWrapper": "saveProbeSettings",
      "dtoOwner": "probe",
      "requestDto": "ProbeSettingsSaveRequest",
      "responseDto": "ProbeSettingsSaveResponse"
    },
    {
      "id": "probe.events",
      "kind": "rpc",
      "scope": "shared",
      "coreUseCase": "probe.events",
      "linuxRpc": "probe.events",
      "tauriCommand": "commands::settings::getProbeEvents",
      "webuiWrapper": "getProbeEvents",
      "dtoOwner": "probe",
      "requestDto": "NoRequest",
      "responseDto": "ProbeEventsResponse"
    },
    {
      "id": "probe.barkTest",
      "kind": "rpc",
      "scope": "shared",
      "coreUseCase": "probe.barkTest",
      "linuxRpc": "probe.barkTest",
      "tauriCommand": "commands::settings::probeBarkTest",
      "webuiWrapper": "runProbeBarkTest",
      "dtoOwner": "probe",
      "requestDto": "NoRequest",
      "responseDto": "ProbeBarkTestResponse"
    },
    {
      "id": "probe.installHooks",
      "kind": "rpc",
      "scope": "shared",
      "coreUseCase": "probe.installHooks",
      "linuxRpc": "probe.installHooks",
      "tauriCommand": "commands::settings::probeInstallHooks",
      "webuiWrapper": "runProbeHooksInstall",
      "dtoOwner": "probe",
      "requestDto": "NoRequest",
      "responseDto": "ProbeInstallHooksResponse"
    },
    {
      "id": "updates.status",
      "kind": "rpc",
      "scope": "shared",
      "coreUseCase": "updates.status",
      "linuxRpc": "updates.status",
      "tauriCommand": "commands::updates::getUpdateStatus",
      "webuiWrapper": "getUpdateStatus",